"http://www.imdb.com/title/tt0461872";"Essential docudrama unexposed nightmare network monsters December 2005 mkham6 See reviews Kudos Mira Sorvino become crusader Lifetime producers making important expose vicious crime hour opus charts single Russian mobster kidnaps rapes transports girls America around world course Mira Donald Sutherland ICE agents heroically chase villains reality little done control vicious predators police usually problem since understanding sympathy plight captive whores punish bully supposed crimes reporter years Russia seen monstrosity criminals awesome beauty sweetness romanticism eroticism girls brought defer please men place people would make month girls would jump Western job could give real life Lured imaginary secretarial maid job Europe would documents taken quickly raped broken total submission Huge numbers sent Israel government ignores problem world Russian girls wanted traffickers johns great beauty literacy skills incredible NPR report explained young girls shipped filthy Mexican nightmare brothels service clients day smuggled America handed pimps Disneyland time terrorized shattered even try get away Russian father improbably joins traffickers find rescue daughter anything docudrama soft peddles horrors couldn take unvarnished truth mandatory viewing every American especially law enforcement hideous crime treated seriously genocide since Sorvino says end shelve life girls used killed diseased years 800000 trafficked every year several Darfurs Bosnias Kosovos Iraqs put together people found review helpful review helpful Yes"
"http://www.merriam-webster.com/dictionary/human trafficking";"noun Definition HUMAN TRAFFICKING organized criminal activity human beings treated possessions controlled exploited forced prostitution involuntary labor"
"http://www.myflfamilies.com/service-programs/human-trafficking";"Pinterest Human Trafficking Safe Harbor Act went effect January 2013 helps ensure safety child victims trafficked sex allows children rescued prostitution get help child welfare professionals instead placed juvenile delinquency allows Department Children Families Department Juvenile Justice law enforcement local partners across state treat help victims abuse receive intensive treatment residential settings already prepared safety success Safe Harbor Act passed 2012 Legislature signed law Gov Rick Scott Human Trafficking modern day slavery Criminalized federal Florida law defined transporting soliciting recruiting harboring providing obtaining another person transport purposes forced labor domestic servitude sexual exploitation using force fraud coercion Find Human Trafficking believe victim Human Trafficking suspect adult victim human trafficking please visit National Human Trafficking Resource Center call 888 3737 888 suspect child victim please call Florida Abuse Hotline 800 ABUSE Essential Links"
"http://www.net-security.org/secworld.php?id=17934";"DARPA Memex project aids fight human trafficking Posted February 2015 Defense Advanced Research Projects Agency DARPA soliciting proposals innovative research maintain technological superiority area content indexing web search Internet agency announced last week Dubbed Memex combination memoryÂ indexÂ hypothetical device described 1945 article Vannevar Bush director Office Scientific Research Development World War project goal develop software enable domain specific indexing public web content domain specific search capabilities Today web search limited one size fits approach offered web scale commercial providers provide centralized search limitations scope gets indexed richness available details explained example common practice misses information deep web ignores shared content across pages Today largely manual search process save sessions allow sharing requires nearly exact input one time entry doesn organize aggregate results beyond list links Initially program aimed help key Defense Department mission fighting human trafficking Human trafficking line business significant web presence attract customers relevant many types military law enforcement intelligence investigations noted use forums chats advertisements job postings hidden services etc continues enable growing industry modern slavery index curated counter trafficking domain includes labor sex trafficking along configurable interfaces search analysis enable new opportunity defeat trafficking enterprises project already helped least one human trafficking investigation Memex plans explore three technical areas interest domain specific indexing domain specific search DoD specified applications DARPA noted added program specifically interested proposals attributing anonymous services deanonymizing attributing identity servers addresses accessing information intended publicly available"
"http://www.polarisproject.org/human-trafficking/overview";"Pause Human trafficking form modern slavery people profit control exploitation others Although slavery commonly thought thing past human trafficking still exists today throughout United States globally traffickers use force fraud coercion control people purpose engaging commercial sex forcing provide labor services Traffickers use violence threats deception debt bondage manipulative tactics trap victims horrific situations every day America trafficking victims share one essential experience loss freedom United States sex trafficking commonly occurs online escort services residential brothels brothels disguised massage businesses spas street prostitution Labor trafficking found domestic servitude situations well sales crews large farms restaurants carnivals two primary factors driving spread human trafficking high profits low risk Like drug arms trafficking human trafficking market driven criminal industry based principles supply demand Every year traffickers generate billions dollars profits victimizing millions people around world including United States Learn human trafficking atÂ www traffickingresourcecenter org Key statistics International Labor Organization estimates areÂ million victims human trafficking globally including million children women girls 2013 theÂ National Human Trafficking Resource Center hotline operated Polaris received multiple reports human trafficking cases states Find hotline statistics International Labor Organization estimates forced labor human trafficking 150 billion industry worldwide official estimate total number human trafficking victims 100000 children estimated sex trade United States year clear total number victims nationally reaches hundreds thousands estimates adults minors sex trafficking labor trafficking aggregated MF2 number human trafficking cases Polaris learns increases every year Read 2014 statistics report VICTIMS Victims frequently lured false promises lucrative job stability education loving relationship victims men women adults children foreign nationals citizens share trait vulnerability victims diverse ethnic socio economic backgrounds varied levels education may documented undocumented defined law victims human trafficking divided three populations Children age induced commercial sex Adults aged induced commercial sex force fraud coercion Children adults induced perform labor services force fraud coercion human trafficking spans demographics circumstances vulnerabilities lead higher susceptibility victimization human trafficking Runaway homeless youth victims domestic violence sexual assault war conflict social discrimination frequently targeted traffickers Foreign nationals paid large recruitment travel fees labor recruiters often become highly indebted recruiters traffickers Traffickers control manipulate individuals leveraging non portability many work visas well victimsâ lack familiarity surroundings laws rights language fluency cultural understanding Victims face many challenges accessing help traffickers may confiscate identification money may speak English may know moved frequently often allowed communicate family friends may trouble trusting others due traffickersâ manipulation control tactics TRAFFICKERS Traffickers lure ensnare people forced labor sex trafficking manipulating exploiting vulnerabilities Human traffickers recruit transport harbor obtain exploit victims often using force threats lies psychological coercion Traffickers promise high paying job loving relationship new exciting opportunities cases may kidnap victims use physical violence control Often traffickers victims share national ethnic cultural background allowing trafficker better understand exploit vulnerabilities victims Traffickers lone individuals extensive criminal networks Pimps gangs family members labor brokers employers domestic servants small business owners large factory owners found guilty human trafficking common thread willingness exploit human beings profit Client Quotes Thanks Polaris Project job home many friends help need making life Survivor Labor Trafficking Client Polaris Top Resources"
"http://www.polarisproject.org/human-trafficking/sex-trafficking-in-the-us";"Sex trafficking form modern slavery exists throughout United States globally Sex traffickers use violence threats lies debt bondage forms coercion force women men children engage commercial sex federal law minor age years induced commercial sex victim sex traffickingâ regardless whether trafficker used force fraud coercion Sex traffickers may lure victims false promise high paying job Others promise romantic relationship first establish initial period false love feigned affection period offer gifts compliments sexual physical intimacy making elaborate promises better life fast money future luxuries However trafficker eventually employs variety control tactics including physical emotional abuse sexual assault confiscation identification money isolation friends family even renaming victims citizens foreign nationals women men children LGBTQ individuals victims sex trafficking Runaway homeless youth victims domestic violence sexual assault war conflict social discrimination frequently targeted traffickers Sex trafficking exists within diverse venues including fake massage businesses online escort services residential brothels public city streets truck stops strip clubs hotels motels elsewhere street based sex trafficking victims often expected earn nightly quota ranging 500 1000 confiscated pimp Women brothels disguised massage businesses typically live site coerced providing commercial sex men day days week Learn sex trafficking including specific details venues sex trafficking frequently occurs atÂ www traffickingresourcecenter org KEY STATISTICS 2013 theÂ National Human Trafficking Resource Center hotline operated Polaris received reports 3609 sex trafficking cases inside United States Find hotline statistics 2013 National Center Missing Exploited Children estimated endangered runaways reported likely sex trafficking victims Globally International Labor Organization estimates areÂ million people trapped forced sexual exploitation globally Learn toÂ Recognize Signs human trafficking community Call hotline 888 373 7888 someone know victim human trafficking Send text BeFree 233733 need help Visit Action Center find opportunities tell elected officials take action sex trafficking Client Quotes Thanks Polaris Project job home many friends help need making life Survivor Labor Trafficking Client Polaris Top Resources"
"http://www.rottentomatoes.com/m/human_trafficking";"View Critic Reviews Audience Reviews Human Trafficking amazing look world many really know wasn expecting watch movie friends ended bring Anyways Donald Sutherland always amazing exception rule Mira Sorvino plays agent gets much involved case ends leading many events long movie yet doesn seem like way goes reminds television series many things happen within blink eye really opens eyes things know Based true story intense film Highly recommended Bannan instant enigma add water Super Reviewer recommend movie virtually everyone shocking truth human trafficking devastate victim life family also society society trying cover things liked way showed extensive scenes violence make aware going sneaky business scariest thing human trafficking around never hear much"
"http://www.soroptimist.org/trafficking/faq.html";"Soroptimist stop trafficking human trafficking billion annual industry modern day trafficking type slavery involves transport trade people purpose work According million people around world ensnared web human trafficking given time Human trafficking impacts people backgrounds people trafficked variety purposes Men often trafficked hard labor jobs children trafficked labor positions textile agriculture fishing industries Women girls typically trafficked commercial sex industry prostitution forms sexual exploitation slaves trafficked trafficking victims victims slavery Human trafficking particularly cruel type slavery removes victim familiar rendering completely isolated alone often unable speak language captors fellow victims Back top sex slavery trafficking Sex trafficking slavery exploitation women children within national across international borders purposes forced sex work Commercial sexual exploitation includes pornography prostitution sex trafficking women girls characterized exploitation human exchange goods money year estimated 800000 women children trafficked across international bordersâ though additional numbers women girls trafficked within countries sex trafficking highly visible street prostitution many trafficking victims remain unseen operating unmarked brothels unsuspectingâ sometimes suburbanâ neighborhoods Sex traffickers may also operate variety public private locations massage parlors spas strip clubs Adult women make largest group sex trafficking victims followed girl children although small percentage men boys trafficked sex industry well Human trafficking migration patterns tend flow East West women may trafficked country another country given time trafficking victims exist everywhere Many poorest unstable countries highest incidences human trafficking extreme poverty common bond among trafficking victims economic alternatives exist women girls vulnerable tricked coerced sexual servitude Increased unemployment loss job security undermined women incomes economic position stalled gender wage gap well increase women part time informal sector work push women poorly paid jobs long term hidden unemployment leaves women vulnerable sex traffickers Back top traffics women girls Organized crime largely responsible spread international human trafficking Sex traffickingâ along correlative elements kidnapping rape prostitution physical abuseâ illegal nearly every country world However widespread corruption greed make possible sex trafficking quickly easily proliferate Though national international institutions may attempt regulate enforce anti trafficking legislation local governments police forces may fact participating sex trafficking rings traffickers traffic sex trafficking extremely lucrative especially areas opportunities education legitimate employment may limited According United Nations Office Drugs Crime UNODC greatest numbers traffickers Asia followed Central Southeastern Europe Western Europe Crime groups involved sex trafficking women girls also often involved transnational trafficking drugs firearms frequently use violence means carrying activities One overriding factor proliferation trafficking fundamental belief lives women girls expendable societies women girls undervalued valued women greater risk abused trafficked coerced sex slavery women experienced improved economic social status trafficking would large part eradicated Back top women trafficked Women girls ensnared sex trafficking variety ways lured offers legitimate legal work shop assistants waitresses Others promised marriage educational opportunities better life Still others sold trafficking boyfriends friends neighbors even parents Trafficking victims often pass among multiple traffickers moving home countries Women often travel multiple countries ending final destination example woman Ukraine may sold human trafficker Turkey passes trafficker Thailand Along way becomes confused disoriented Typically custody traffickers victim passport official papers confiscated held Victims told destination country illegally increases victims dependence traffickers Victims often kept captivity also trapped debt bondage whereby obliged pay back large recruitment transportation fees released traffickers Many victims report charged additional fines fees bondage requiring work longer pay debts Human trafficking victims experience various stages degradation physical psychological torture Victims often deprived food sleep unable move freely physically tortured order keep women captive victims told families children harmed murdered women try escape tell anyone situation victims rarely understand culture language country trafficked experience another layer psychological stress frustration Often servicing clients women forcibly raped traffickers order initiate cycle abuse degradation women drugged order prevent escaping broken inâ sex trafficked victims service men day vulnerable sexually transmitted diseases HIV infection unwanted pregnancy Back top purchases trafficked women girls Many believe sex trafficking something occurs somewhere else However many biggest trafficking consumers developed nations men sectors society support trafficking industry one profile encapsulates typicalâ client Rather men purchase trafficked women rich poor Eastern Western Many married children cases reported one New York Times article men sex trafficked girls lieu abusing young children One reason proliferation sex trafficking many parts world little perceived stigma purchasing sexual favors money prostitution viewed victimless crime women culturally socially devalued many societies little conflict purchasing women girls sexual services realize explicit connection commercial sex trade trafficking women girls illegal slave trade western society particular commonly held perception women choose enter commercial sex trade However majority women sex trade specifically case trafficked women girls coerced forced servitude simply case addition sex tourismâ practice traveling vacationing purpose sexâ billion dollar industry encourages sexual exploitation women girls Many sex tours explicitly feature young girls tours marketed specifically pedophiles prey young children men believe sex virgins young girls cure sexually transmitted diseases STDs Often men spread HIV STDs young victims creating localized disease epidemics Back top impact sex trafficking Trafficking harrowing effect mental emotional physical well women girls ensnared web Beyond physical abuse trafficked women suffer extreme emotional stress including shame grief fear distrust suicidal thoughts Victims often experience post traumatic stress disorder acute anxiety depression insomnia Many victims turn drugs alcohol numb pain Sex trafficking promotes societal breakdown removing women girls families communities Trafficking fuels organized crime groups usually participate many illegal activities including drug weapons trafficking money laundering negatively impacts local national labor markets due loss human resources Sex trafficking burdens public health systems trafficking erodes government authority encourages widespread corruption threatens security vulnerable populations Back top Soroptimist stop human trafficking organization business professional women working improve lives women girls local communities throughout world Soroptimist undertakes number projects directly indirectly help potential trafficking victims late 2007 organization launched major campaign aimed raising awareness devastating practice sex trafficking Soroptimist club members place cards sex trafficking highly visible locations including police stations women centers hospitals legal aid societies etc addition organization calling public part end heinous practice Soroptimist undertakes number projects directly indirectly help victims potential victims projects provide direct aid women girlsâ giving women economic tools skills achieve financial empowerment independence Live Dream Awards programâ Soroptimist major projectâ provides women heads households resources need improve education skills employment prospects helping women receive skill resource training Soroptimist provides trafficking potential trafficking victims economic options Soroptimist Club Grants Women Girls program provides Soroptimist clubs cash grants innovative projects benefiting women girls Many clubs undertake projects directly indirectly benefit trafficking victims Soroptimist club Philippines supports shelter abused women girls escaping sex trafficking club California held conference support Western Regional Task Force Stop Human Trafficking club Chicago held several educational events related trafficking Soroptimist presents Human Trafficking Facts Making Difference Women Award program honors women work improve lives women girls Kathryn Xian recent recipient 2004 led grassroots campaign local tour company offering Asian sex tours also testified Hawaii State House Representatives hearing trafficking hearings resulted passage Act makes promoting travel prostitutionâ Class felony violation Act serves model legislation states Soroptimist strive presents Human Trafficking Facts make difference women lives worldwide Soroptimist Disaster Relief Fund provides financial assistance regions affected natural disasters acts war special attention paid services benefiting women girls Women girls affected disasters often vulnerable traffickers suspect incident sex trafficking United States call National Human Trafficking Resource CenterÃ hour toll free hotline number 888 3737 888 Callers receive number services including crisis intervention urgent non urgent referrals tip reporting comprehensive anti trafficking resources"
"http://www.state.gov/j/tip";"Office Monitor Combat Trafficking Persons Stay Connected Trafficking Hotlines Department Stateâ Office Monitor Combat Trafficking Persons headed Acting Director Kari Johnstone leads United States global engagement human trafficking umbrella term used describe activities involved someone obtains holds person compelled service Partnerships ought concern every person debasement common humanity ought concern every community tears social fabric ought concern every business distorts markets ought concern every nation endangers public health fuels violence organized crime talking injustice outrage human trafficking must called true name modern slavery President Barack Obama Open Competition 2015 Funding Department Stateâ Office Monitor Combat Trafficking Persons TIP Office announces open competition 2015 funding projects combat trafficking persons outside United States first stage competition begins solicitation two page Statements Interest SOI eligible organizations interested submitting proposals projects address country specific requirements identified solicitation based 2014 Trafficking Persons Report TIP Report MoreÂ Coalition Immokalee Workers Receives 2015 Presidential Award Extraordinary Efforts Combat Trafficking Persons Secretary Kerry Jan Itâ honor present Coalition Immokalee Workers award reads extraordinary efforts combat human trafficking pioneering Fair Food Program empowering agricultural workers leveraging market forces consumer awareness promote supply chain transparency eradicate modern slavery participating farms award Presidential Award Full TextÂ Strengthening Protections Trafficking Persons Federal Corporate Supply Chains VeritÃ released report risk trafficking persons federal corporate supply chains Providing comprehensive framework evaluating trafficking risk report identifies key sectors heightened risk human trafficking maps federal spending key risk sector Department State funded report essential resource government officials federal contractors concerned compliance Executive Order 13627 well businesses concerned human trafficking supply chains Full ReportÂ 2014 Trafficking Persons Report Secretary Kerry June million people conservative estimate victims human trafficking United States first acknowledge government anywhere yet enough Full TextÂ BriefingÂ ReportÂ Fact SheetsÂ Journey Freedom Freedom Center Documentary Journey Freedom tells true stories two men 21st Century Cambodian Vannak Prum 19th Century American Solomon Northup sold slavery 150 years apart TranscriptÂ Fact SheetsÂ MoreÂ"
"http://www.theguardian.com/law/2015/feb/09/rev-libby-lane...human-trafficking";"Sorry havenâ able serve page asked 404 may followed broken outdated link may error site Please follow one links continue exploring"
"http://www.theguardian.com/law/human-trafficking";"Sister Ancy Mathew provides care women freed clutches criminals London Published Nov 2014 Modern day slavery focus global slavery index based flawed data one say Anne Gallagher Anne Gallagher anti trafficking community remained uncritical Walk Freeâ methodology yet poor information often leads damaging decisions Published Nov 2014"
"http://www.unodc.org/unodc/en/human-trafficking/what-is-human-trafficking...";"NGOs civil society Page requested found Unfortunately page requested available Please make sure web address correct looking resource moved due reorganization unodc org missing let know best point right direction also use Search locate pages files report broken link visit Contact page address error soon possible"
