"http://humantrafficking.org";"Child victims human trafficking helped IOM increased 2040 2011 per cent 1565 2008 according new IOM data Posted April 2012 Read General Assembly President calls redoubled efforts end human trafficking President 66th United Nations General Assembly Excellency Nassir Abdulaziz Nasser today called Member States civil society private sector media step efforts bring end human trafficking calling appalling form human rights abuse Posted April 2012 Read crime fighting office announced million people across globe victims human trafficking one time percent exploited sexual slaves Posted April 2012 Read Washington Legislature passed Governor Gregoire signed law bill would require websites within state obtain documentation escorts advertised least Posted April 2012 Read Estonia Parliament passed legislation banning human trafficking making Baltic nation last country enact laws Posted April 2012 Read"
"http://humantraffickingsearch.net";"South Bay Forefront Fight Human Trafficking NBC Bay Area NBC Bay Area Feb Jolie Harris years old wasn exactly easy relate classmates school Menlo Park fact story would attracted attention law enforcement Stephanie Chuang reports video aired Feb 2015 Read Human trafficking close home problem expert says OSU Lantern OSU Lantern Feb happened human trafficking absence law saying someone benefit labor ways keeping people enslaved developedÃ Hannan said presentation speech good news theÂ Read Brooke Axtell survivor human trafficking domestic abuse storms Washington Post Washington Post Feb Last night years trafficked became face awards show push domestic violence speaking Grammys audience millions Authentic love devalue another human Authentic love notÂ Read Catholics urged combat human trafficking Catholic Herald Online Catholic Herald Online Feb must everything power corporal spiritual works mercy eradicate human traffickingÃ bishop told nearly 1000 people including trafficking survivors gathered noon Mass Basilica moreÂ Read Montgomery County expand human trafficking crackdown Gazette Net Maryland Community News Online Gazette Net Maryland Community News Online Feb Montgomery County shut dozens businesses identified fronts human trafficking last five years county hopes better regulation called bodywork businesses clamp problem Across moreÂ Read Photos Kay ChernushArtWorks Freedom View Gallery click map toSearch region"
"http://michigan.gov/ag/0,4534,7-164-60857---,00.html";"Human Trafficking Human TraffickingAround country right Michigan men women children forced prostitution domestic servitude labor little pay Human trafficking modern day form slavery second largest fastest growing criminal industry world Attorney General Schuette leading fight horrific crime prosecuting state first ever criminal cases state law banning human trafficking Michigan Victims human trafficking bondage force fraud coercion purpose sex labor exploitation children especially risk human trafficking cases involve sexual exploitation child Constitution 13th Amendment guarantees neither slavery involuntary servitude shall exist Attorney General Schuette top law enforcement officer Michigan remains dedicated protecting children upholding Constitution guarantee fundamental freedom took office 2011 one early initiatives establish special unit prosecute human traffickers Since office worked aggressively law enforcement task forces ferret modern day slavers put end trade human beings especially child victims also conducted trainings law enforcement prosecutors work community advocates raise awareness despicable crime would like learn human trafficking please explore information"
"http://notforsalecampaign.org/human-trafficking";"Human Trafficking acquisition people using force deception coercion intent exploit Men women children sold 150 billion annual market sex labor happening globally domestically urban suburban areas hotels restaurants street corners Slavery wrapped almost every industryÃ supply chain tainting food eat clothes buy electronics love international drug trade trafficking humans tied arms dealing second largest criminal industry world Human trafficking recruitment transportation transfer harboring receipt persons means threat use force forms coercion abduction fraud deception abuse power position vulnerability giving receiving payments benefits achieve consent person control another person purpose exploitation Labor Trafficking Debt Bondage common forms trafficking today Sex trafficking often highlighted media primary form modern day slavery Using coercion violence deception labor traffickers force victims work industries range small mom pop shops enormous mineral extraction camps commodities gold individuals enter work agreements willingly accrue enormous debt trafficker form food shelter documentation travel fees traffickers inflate costs tack enormous interest rates condemn new hires life underpaid labor slavery Sex Trafficking generates billion illegal profits Victims sex trafficking forced work commercial sex trade Physical emotional violence intrinsic part industry preys individuals conditions physical economic psychological vulnerability keep working victims threatened lied beaten traffickers pimps control money practice exists within sectors sex industry including street prostitution strip clubs residential brothels pornography stores massage parlors Acronym know COMMERCIAL SEXUAL EXPLOITATION CHILDREN sexual abuse minor economic gain majority child victims come environments extreme instability suffered sexual abuse prior commercial exploitation Homeless street youth facing food shelter insecurities also easy targets Traffickers ensnare victims using violence coercion lies threats Traffickers strangers acquaintances family members friends economic physical social vulnerability victims makes easy prey traffickers lure promises chance better life Many come country cultural background victims enabling easily exploit particular vulnerabilities targets traffickers employ violence kidnap maintain control victims abundant money made soaring demand little risk due difficulties identification crime high burden proof legal teams lowers barrier entry men women profit human trafficking trafficking exist skyrocketing demand Consumer demand cheap products labor services enormous commercial sex industry business booming Traffickers work virtually every country around world move wherever greatest profit extracted prime recruitment zones shift rapidly best exploit opportunities Combating crime complicated covert nature coupled improperly trained government civic bodies corruption lax enforcement laws statutes create perception low risk traffickers Globalization brought growing ease conducting business across national borders Business supply chains increasingly complex raw materials products come world businesses selling shirts chocolate cell phones rarely know raw materials coming assembling products final stages Numerous brokers middlemen complicate attempts link finished product individual produced fraction parts lack transparency allows unregulated production many times unsafe illegal practices workplace including modern day slavery Invest world free slavery Donate 2225 3rd"
"http://oag.ca.gov/human-trafficking";"Human Trafficking California Human Trafficking Human trafficking world fastest growing criminal enterprise estimated billion year global industry drug trafficking human trafficking world second profitable criminal enterprise status shares illegal arms trafficking Like drug arms trafficking United States one top destination countries trafficking persons California populous border state significant immigrant population world ninth largest economy one nation top four destination states trafficking human beings Transnational domestic gangs recently expanded trafficking guns drugs trafficking human beings Transnational gangs use cross border tunnels move guns drugs also human beings Mexico California Domestic street gangs set aside traditional rivalries set commercial sex rings maximize profits sale young women perpetrators human trafficking become sophisticated organized requiring equally sophisticated response law enÂ forcement partners disrupt dismantle networks Internet new technologies also transformed landscape human trafficking Traffickers use social media online tools recruit victims case sex trafficking find communicate customers technology used perpetrate human trafficking technology provide digital trail valuable investigative tool law enforcement monitor collect analyze online data activities currently efforts underway study develop innovative technologies prevent disrupt human trafficking online Internet social media mobile devices also provide new avenues outreach victims raising public awareness atrocious crime website hub information resources designed highlight important work done across state raise awareness serve victims bring perpetrators justice create future without human trafficking Kamala Harris"
"http://oag.ca.gov/human-trafficking/what-is";"Human Trafficking California Human Trafficking Human trafficking modern form slavery involves controlling person force fraud coercion exploit victim forced labor sexual exploitation Human trafficking strips victims freedom violates nationâ promise every person United States guaranteed basic human rights also crime Approximately three every 1000 persons worldwide forced labor given point time 2002 2011 Victims human trafficking include men women lured forced labor promise better life United States also boys girls born raised California Victims human trafficking represent range backgrounds terms age nationality socioeconomic status education one characteristic usually share form vulnerability often isolated families social networks cases victims separated country origin native language culture Victims undocumented immigrants often report abuses authorities distrust law enforcement fear arrest injury family members deportation serious reprisals Many domestic victims sex trafficking underage runaways come backgrounds sexual physical abuse incest poverty addiction Definitions Human Trafficking California California Legislature defined human trafficking acts involved recruitment abduction transport harboring transfer sale receipt persons within national across international borders force coercion fraud deception place persons situations slavery slavery like conditions forced labor services forced prostitution sexual services domestic servitude bonded sweatshop labor debt bondage codified California Penal Code anyone deprives violates personal liberty another intent obtain forced labor services guilty human trafficking Depriving violating person liberty includes substantial sustained restriction another liberty accomplished fraud deceit coercion violence duress menace threat unlawful injury victim another person circumstances person receiving apprehending threat reasonably believes likely person making threat would carry Forced labor services include labor services performed provided person obtained maintained force fraud coercion equivalent conduct would reasonably overbear person Federal Federal law defines trafficking persons sex trafficking commercial sex act induced force fraud coercion person induced perform act attained years age recruitment harboring transportation provision obtaining person labor services use force fraud coercion purpose subjection involuntary servitude peonage debt bondage slavery International Labour Organization ILO ILO agency United Nations defines human trafficking recruitment transportation transfer harboring receipt persons means threat use force forms coercion abduction fraud deception abuse power position vulnerability giving receiving payments benefits achieve consent person control another person purpose exploitation Exploitation shall include minimum exploitation prostitution others forms sexual exploitation forced labor services slavery practices similar slavery servitude removal organs Difference Human Trafficking Smuggling Though often confused human trafficking smuggling separate fundamentally different crimes Human trafficking crime person whereas smuggling crime state Smuggling occurs person voluntarily requests hires person known smuggler transport across border fee least theoretically person smuggled United States free leave upon payment prearranged fee victim human trafficking enslaved supply labor services Unlike smuggling crime human trafficking require travel transportation victim across borders Thus human trafficking occur domestically victims born raised California states Human Trafficking United States United States widely regarded destination country human trafficking Federal reports estimate 14500 17500 victims trafficked United States annually include number victims trafficked within United States year Human Trafficking California diverse cultural center popular destination immigrants multiple international borders California one largest sites human trafficking United States two years July 2010 June 2012 California task forces initiated 2552 investigations identified 1277 victims human trafficking arrested 1798 individuals Types Human Trafficking Sex Trafficking Sex trafficking act forcing coercing transporting person purpose commercial sex act crimes primarily committed women children Sex trafficking occur residential brothels brothels disguised massage parlors strip clubs via online escort services street prostitution Read"
"http://usccb.org/about/anti-trafficking-program";"Anti Trafficking Program default one video player automatically used show videos grabbed users get code feature one players Creating world immigrants refugees migrants people move treated dignity respect welcome belonging Migration Refugee Services Vision Statement News Church first responderâ human trafficking Sunday Visitor June 12th 2014Â New Year ResolutionsÂ Coalition Catholic Organizations Human Trafficking CCOAHT convened USCCB CCUSA member crafted set New Yearsâ Resolutions Human Traffickingâ list actions related trafficking public commit 2015 New Yearsâ resolutions invite commit resolutions share networks use SlavesNoMore raise awareness issue human trafficking mission Conference Catholic Bishops Anti Trafficking Program ATP educate scourge human trafficking offense fundamental dignity human person advocate end modern day slavery provide training technical assistance issue year estimated 17000 vulnerable men women children trafficked across borders forced slavery Many fleeing terrible situations home countries come United States find better life Unfortunately nightmare often begins reach shores decade United States Conference Catholic Bishops USCCB national leader advocacy education eradicate sex labor trafficking six years USCCB partners provided intensive case management services victims ofÂ human trafficking assisting 2232 survivors trafficking 500 family members Currently concentrating efforts training technical assistance victims identified brought safety Hopefully one day eradicate horrible crime modern day slavery Slaves January 2015 Pope Francis commemorate World Day Peace theme Slaves brothers sisters alignment message new year invite answer Pope Francis call build civilization based equal dignity every person join efforts eliminate scourge human trafficking making personal commitment 2015 resolve fight human trafficking Download backgrounder find February International Day Prayer Awareness Human Trafficking 2014 Pontifical Council Justice Peace International Union Superiors General designated February 8th feast day Josephine Bakhita annual day prayer awareness human trafficking day theÂ USCCB encourages host attend prayer services reflect experiences suffered human trafficking exploitation Find February 8th Day Prayer Josephine Bakhita Current Programs Dignity Work HHS Office Planning Research Evaluation ATP launched Dignity Work program provide employment services group individuals eligible benefits previously program serve individuals pre certified received certification ready employment services missed vital assistance help enter legitimate workforce Dignity Work program currently operates Los Angeles Venice New York Louisville Boston Hartford Houston Anti Trafficking Program working network provide employment services individuals cities identified around country Amistad Movement Amistad Movement human trafficking education awareness campaign immigrant communities programming USCCB found immigrants vulnerable exploitation trafficking many work industries poorly regulated agricultural domestic hospitality service Anti Trafficking Program staff trains individuals communities conduct outreach educate peers human trafficking resources services available victims SHEPHERD Campaign SHEPHERD Campaign campaign help Catholics learn human trafficking well work parish community address issue Rescue Evaluation Strategies Integrate Survivors Trafficking partnership Georgetown University Institute Study International Migration ISIM received funding Department Justice conduct month research project present profile survivors human trafficking evaluate effectiveness interventions stabilize rehabilitate integrate wider American society using data administration nationalÂ per capita contract funded Government Department Health Human Services HHS well collecting original recent data including site interviews prior service providers clients objective project better understanding characteristics trafficked victims efficacy different intervention strategies stabilizing well Help DONATE Help fight human trafficking making contribution New York Florida District Columbia donate online another state please National Catholic Fund Migration Refugee Services Part Solution Learn Human Trafficking Click find issue human trafficking learn Catholic Church teaching subject Learn Become Shepherd program observant Identify victims community respond appropriately Use Red Flags Screening Questions Identify Victims Take Action Spread word Help distribute posters resources community resources request technical assistance training consultancy services contact Anti Trafficking Services 202 541 3357 informed"
"http://www.acf.hhs.gov/programs/endtrafficking";"Look Beneath Surface January 2014 informational video human trafficking identify assist victims part Rescue Restore Victims Human Trafficking Get Help Report Tip National Human Trafficking Resource Center hours day days week 888 373 7888"
"http://www.acf.hhs.gov/programs/orr/resource/fact-sheet-human-trafficking";"Official Campaign Material PDF 143KB Definition Trafficking Persons Victims Trafficked Trafficking Smuggling Help Victims Trafficking Human trafficking form modern day slavery Victims human trafficking subjected force fraud coercion purpose commercial sex debt bondage forced labor young children teenagers men women Trafficking persons occurs throughout world including United States Trafficking Victims Protection Act 2000 TVPA defines severe forms trafficking personsâ follows Sex trafficking recruitment harboring transportation provision obtaining person purpose commercial sex act commercial sex act induced force fraud coercion person induced perform act attained years age Labor Trafficking recruitment harboring transportation provision obtaining person labor services use force fraud coercion purpose subjection involuntary servitude peonage debt bondage slavery TVPA term commercial sex actâ means sex act account anything value given received person Victims Trafficked Many victims trafficking particularly women children exploited purposes prostitution pornography However trafficking also takes place diverse labor contexts domestic servitude small businesses factories agricultural work Traffickers use force fraud coercion compel women men children engage activities Force involve use physical restraint serious physical harm Physical violence including rape beatings physical confinement often employed means control victims especially early stages victimization trafficker breaks victimâ resistance Fraud involves false promises regarding employment wages working conditions matters example individuals might travel another country promise well paying work farm factory find manipulated forced labor Others might reply advertisements promising modeling nanny service industry jobs overseas forced prostitution arrive destination Coercion involve threats serious harm physical restraint person scheme plan pattern intended cause person believe failure perform act would result serious harm physical restraint person abuse threatened abuse legal process Victims trafficking often subjected debt bondage peonage traffickers demand labor means repayment real alleged debt yet reasonably apply victimâ wages toward payment debt limit define nature length debtorâ services Traffickers may charge victims fees transportation boarding food incidentals interest fines missing daily work quotas charges bad behaviorâ may added Debt bondage traps victim cycle debt never pay part larger scheme psychological cruelty Human trafficking human smuggling two separate crimes federal law several important differences Human Trafficking Human Smuggling Victims forced defrauded coerced trafficking Even victims initially offer consent consent rendered meaningless actions traffickers exploit labor services commercial sex Individuals consent smuggled Human trafficking crime committed individual Smuggling crime committed country borders Trafficking need entail physical movement person Smuggling involves illegal transport individual across national border Smuggling always transnational Help Victims Trafficking Prior enactment TVPA 2000 comprehensive Federal law existed protect victims trafficking prosecute traffickers TVPA subsequent reauthorizations worked prevent human trafficking United States abroad increase prosecution human traffickers protect victims providing benefits services help rebuild lives United States Information services trafficking victims available Victim Assistance fact sheet Certification Adult Victims Trafficking fact sheet Child Victims Human Trafficking fact sheet think come contact victim human trafficking call National Human Trafficking Resource Center 888 373 7888 NHTRC help identify coordinate local organizations protect serve trafficking victims National Human Trafficking Resource Center 888 373 7888 page helpful"
"http://www.atg.wa.gov/HumanTrafficking/SexTrafficking.aspx";"Call theÂ Human Trafficking Hotline 888 373 7888Â Toll free Confidential Domestic minor sex trafficking victimsÂ citizens lawful permanent residents age recruited harbored transported provided obtained perform commercial sex acts defined sex acts done exchange monetary non monetary gain Domestic minor sex trafficking DMST becoming burgeoning risk factor American youth gangs find prostituting minors source prestige income traffickersÂ discover American children easier recruit sell foreign victims need cross border Recent examples DMST Washington September 2009 Seattle PIÂ reportedÂ year oldÂ Seattle man forced two underaged girls year old year old prostitute financial benefit girls run away home TheÂ Department Justice Western District Washington reports February 2011 two Tacoma men pled guilty sex trafficking ofÂ underaged girls National Statistics Domestic Sex Trafficking TheÂ Department Justice Child Exploitation Obscenity Section reports average age entry pornography prostitution According toÂ Shared Hope International eight 112 minors trafficked stateÂ Nevada prostitution August 2005 December 2006 Washington state Common Myths Defenders USA Child sex trafficking isn happening estimatedÂ 293000 childrenÂ danger sexually trafficked victims American children youth races different backgrounds range age infants teens Investigative research Shared Hope International reveals pimps commonly sell minor girls 400 hour Americaâ streets Human rights investigations Shared Hope International discovered minors sold average times day days week totaling 9360 14040 sex acts year girlsÂ received none money small percentage people look child pornography purchase kids sale average age entry porn prostitution ages often mislabeled pornographic images child sale child pornography become billion dollarÂ industry 100000 websites offer child pornography percentÂ internet child pornography comes Trafficking Persons Report 2011 State Department annual Trafficking Persons Report examines human trafficking 184 countries including year report revealed United States source transit destination country men women children subjected forced labor debt bondage document servitude sex trafficking Trafficking occurs commercial sexual exploitation street prostitution massage parlors brothels labor domestic service agriculture manufacturing janitorial services hotel services hospitality industries construction health elder care strip club dancing 2010 collectively federal law enforcement charged 181 individuals obtained 141 convictions 103 human trafficking prosecutions labor trafficking sex trafficking numbers reflect prosecutions cases involving commercial sexual exploitation children brought statutes TVPAâ sex trafficking provision last decade human trafficking cases state statutes initiated states majority state cases involved child sex trafficking least three states used state statutes forced labor prosecutions Less percent state local law enforcement agencies surveyed protocols policies human trafficking recommended augmented training standard operational protocols dedicated personnel within police agencies citizen child victims often runaways troubled homeless youth Resources educators parents youth workers law enforcement"
