"http://articles.chicagotribune.com/keyword/gun-control";"Gun control December 2012 gun manufacturers design future weapons chip Allow weapons fired designated area one shome Hunters would required get permission hunt given area time sensitive chip location chip installed Mike Mueller Tucson NEWS Gun control group sues Kansas governor gun rights law Carey Gillam Reuters July 2014 OVERLAND PARK Kan Reuters gun violence prevention group sued Kansas Governor Sam Brownback state attorney general Wednesday challenging one year old state law grounds violates Constitution nullifying federal laws aimed reducing firearms violence Neither Kansas legislature state legislature empowered declare federal law invalid criminalize enforcement federal law lawsuit said Advertisement Gun control timid advocates Jules Witcover Tribune Media Services September 2013 WASHINGTON clamor White House many Congress address American scourge gun violence signs continue point half measure solution best President Obama State Union plea nation lawmakers victims Newtown tragedies deserve vote gun control legislation sounding like advice provide window dressing bold action curb mayhem Obama administration called three pronged OPINION Research candidates stand gun control May 2014 look back another tragedy California involving guns ongoing violence Chicagoland area one thing believe owe educated legislators stand guns disagree many people see overwhelming evidence countries gun control save lives believe prevent killings save lives However regardless individual position issue know OPINION Australia gun control Success failure Steve Chapman January 2013 mass shooting 1996 Australia enacted sweeping package gun restrictions far ambitious anything plausible including total ban semiautomatic weapons mandatory gun buyback strict limits could firearm John Howard prime minister time wrote day country safer today consequence gun control would think dramatic new restrictions bound help NEWS Senator renew gun control push California shooting spree Reuters May 2014 WASHINGTON Reuters Senator Richard Blumenthal said Sunday wanted revive gun control legislation rejected Congress wake 2012 Newtown Connecticut school massacre saying could helped prevent weekend deadly California shooting spree Blumenthal Democrat Connecticut said CBS Face Nation program legislation failed last year could revised emphasize mental condition potential gun OPINION Gun control long overdue February 2013 week performing high school band President Barack Obama inauguration year old honor student Hadiya Pendleton shot killed Hadiya story captured attention media politicians finally focused post Newtown gun violence toll takes communities Yet one hundreds children killed year firearms hundreds victims nameless faceless media mourned parents sisters brothers friends NEWS New Jersey gun control bill passes Assembly heads governor desk Daniel Kelley Reuters May 2014 Reuters New Jersey state Assembly Thursday sent Governor Chris Christie gun control bill would limit capacity gun ammunition magazines unclear whether Republican governor would sign measure law Christie widely perceived possible White House contender 2016 mixed record gun control given indication plans measure bill approved Assembly vote OPINION firm gun control September 2013 illustration United States flag Nancy Ohanian Sunday Voice People Editorial Page September speaks volumes Indeed flag may well comprised rifles missing stars representing legislators pledge allegiance National Rifle Association instead serving people allowing easy access guns ammunition criminals serious mental health issues NEWS End road approaches prominent Boston gun control sign Scott Malone Reuters May 2014 BOSTON Reuters iconic sign bearing pro gun control messages hung near Fenway Park Boston almost two decades soon lose home 252 foot long meter long billboard features counter tracking 45000 people killed guns United States since December 2012 attack Newtown Connecticut elementary school prominent feature Boston since real estate developer John Rosenthal ordered OPINION Research candidates stand gun control May 2014 look back another tragedy California involving guns ongoing violence Chicagoland area one thing believe owe educated legislators stand guns disagree many people see overwhelming evidence countries gun control save lives believe prevent killings save lives However regardless individual position issue know ENTERTAINMENT Hollywood Think Twice Shooting Heavily Armed Georgia Brian Lowry Variety May 2014 Watch lately hard miss little peach logo indicating program shot Georgia shooting different kind something Georgians appear particularly enamored enacted permissive gun law one allows good boys gals pack concealed heat anywhere taverns schools given Hollywood complicated relationship violence pop culture accused OPINION Obama anti gun anti gun control Steve Chapman February 2010 Among many groups opposed Barack Obama presidential race certain vehement gun rights organizations Barack Obama would anti gun president American history National Rifle Association announced Obama committed anti gunner warned Gun Owners America stunner year office president getting hammered people use policy firearms surprise people NEWS Former New York Mayor Bloomberg spend million gun control Reuters April 2014 WASHINGTON Reuters Former New York Mayor Michael Bloomberg ramped efforts fight gun violence Wednesday plan spend million grassroots network organize voters gun control initiative political target powerful pro gun lobby including National Rifle Association spends millions dollars year back gun rights supporters Bloomberg group called Everytown Gun Safety focus ENTERTAINMENT Piers Morgan Signs CNN Gun Control Plea Final Shot NRA Maane Khatchatourian Variety March 2014 Piers Morgan wrapped CNN news show Friday night three years air plea stricter gun control laws Although spent majority one hour program discussing missing Malaysia Airlines flight 370 host dedicated last minutes Piers Morgan Live gun legislation cited 2012Ã Â²s mass shootings Sandy Hook Elementary Newtown Conn screening Dark Knight Rises Aurora OPINION assume liberals always put principles profits Jonah Goldberg March 2014 Leland Yee Democratic state senator candidate secretary state California longtime champion gun control week arrested numerous charges including conspiracy deal firearms without license conspiracy illegally transport firearms Yee prominent foe assault weapons allegedly took bribes set meeting undercover agent international arms dealer broker sale automatic weapons ENTERTAINMENT Gun Control Groups Urge Cancellation Hollywood Fundraiser Mark Begich Mark Pryor Ted Johnson Variety March 2014 Almost year ago aftermath shootings Newtown Conn number entertainment industry activists decried vote prevented Senate moving forward background check legislation vowed withhold support Democrats voted including Sen Mark Begich Alaska Sen Mark Pryor Ark midst tough reelection races"
"http://www.nsafunfinder.com/uk/adult-dating-in-bedford.html";"Send flirt meet hot singles Biddenham Castle Parys Great Denham Harpur Queens ParkBiddenham Castle Parys Great Denham Harpur Queens ParkBrickhill Clapham Parys Goldington Harpur Newnham Putnoe Renhold Salph EndCauldwell Elstow Harrowden Kempston Kingsbrook Shortstown WixamsBourne End Brogborough Box End Bromham Cranfield Carlton Felmersham Harrold Husborne Crawley Keeley Green Kempston Rural Lidlington Lower Shelton Marston Moretaine Newton Blossomville Oakley Odell Pavenham Radwell Ridgmont Stagsden Stevington Stewartby Turvey Upper Shelton West End Wood End Wootton Wootton GreenBegwary Bletsoe Blunham Bolnhurst Cardington Chawston Colesden Colmworth Cople Duck Cross Great Barford Keysoe Keysoe Row Kingsbrook Knotting Knotting Green Little Staughton Melchbourne Milton Ernest Mogerhanger Newton Bromswold Pertenhall Ravensden Riseley Roxton Sharnbrook Souldrop Swineshead Thurleigh Top End Wilden Willington Wyboston YieldenAmpthill Barton Clay Clophill Cotton End Flitton Flitwick Gravenhurst Greenfield Haynes Haynes Church End Herring Green Houghton Conquest End Kempston Hardwick Maulden Millbrook Pulloxhill Sharpenhoe Silsoe Steppingley Westoning WilsteadBozeat Great Doddington Irchester Podington Wollaston nsa fun thousands active singles NSAFunFinder com looking casual sex dating right Meet Friend Benefits Bedford MK41 area smurfgirl average every day couple looking meet couples lifestyle Ken Barbie looking must height weight proportionate 120 pounds 165 pounds prefer BIG COUPLES prefer swap face pics see every one interested make meet greet preferably place things well click could room room bed sex Full swap soft swap fine actually issues women performing oral Pain Bondage Chocking Golden Showers Sick stuff"
"http://abcnews.go.com/topics/news/issues/human-trafficking.htm";"Rome Officials Mull Red Light Prostitution Zone Sun Feb 2015 streets would risk fines 500 euros 550 plan Pope Francis decried shameful plague human trafficking urged prayer reflection problem Marino political roots centrist faction Italian Kosovo President Urges End Illegal Migration Fri Feb 2015 illegally Hungary Police said detained people face legal action including suspected people smuggling says percent Kosovars unemployed poverty rate short percent Kosovo citizens Police Use Sex Trade Online Tactics Arrest Hundreds Tue Feb 2015 trafficking promoting prostitution news release Dart office said women juveniles victims human trafficking rescued johns paid 340000 fines police seized weapons making arrests Look Sundance Fest Films Coming Screen Near Mon Feb 2015 international territories Dreamcatcher documentary Chicago Dreamcatcher Foundation work end human trafficking picked Showtime Dope writer director Rick Famuyiwa crowd pleasing coming age story Obamaâ Pick Attorney General Hot Seat Wed Jan 2015 pornography cases prosecuted brutal international human trafficking rings sold sold victims young fourteen fifteen sexual slavery confirmed attorney general continue Lured Streets Look Young Women Become Sex Trafficking Victims Fri Jan 2015 person life Jayne Bigelsen director anti human trafficking initiatives Covenant House International said drives Police Manhattan District Attorneyâ Office Human Trafficking Courts authorities find recruiters Young people New Year New Rules Look Laws Going Effect 2015 Thu Jan 2015 possessing Strengthening laws human trafficking New laws human trafficking Iowa create harsher penalties programs support victims human trafficking law also give county attorneys Dan Austin Gives Bikes Survivors Human Trafficking Mon Dec 2014 writer founder vintage bikes nonprofit Dell bikes girls especially news survivors human trafficking drugs Core project desire connects desire connect people donors recipients Underground World Colombia Child Sex Trafficking Trade Wed Oct 2014 investigator homeland security specializing human trafficking cases imagine work Liam Neeson character Reporter believes rescuing children slavery big Lincoln fan planned Malala Yousafzai Wins 2014 Nobel Peace Prize Fri Oct 2014 childhood anti childhood slavery campaigning efforts slavery know whacking abolish human trafficking child slavery Human slavery human trafficking especially comes Attorney General Eric Holder Announces Resignation Thu Sep 2014 harder Law enforcement job Hundreds watched department brought record number prosecutions human trafficking hate crimes one America afraid walk street color Pope Francis Receives Warm Welcome South Korea Sat Aug 2014 first time public communicate people Peace quiet weeks Drug done human trafficking nation Think heated seats displays hopefuls touched heart even non Catholic Pope Opening Arguments Capitol Hill Note Wed Jul 2014 smuggle people Central America United States figured loophole 2008 law dealt human trafficking Cornyn told ABC JEFF ZELENY host Fine Print interview WATCH http yhoo 1t2XCWs North Border Note Thu Jul 2014 highly controversial among Democrats human trafficking aspect original bill also expected group Republicans pushing reverse 2008 human trafficking law center latest border crisis World Cup America Senator Cites Fairness Strip Qatar 2022 Contest Mon Jul 2014 Bangladesh pay dollars day treat manner human rights groups equated modern day slavery FIFA obligation think individual countries obligation meet highest standards Inside America Secret Neighborhood Brothels Wed Jun 2014 girls pretty Yes nothing modern day slavery Wars fought end country done around united States combat sex slavery I79 going take lot efforts Syrian Mother Speaks Son Sold Battle Sat Jun 2014 Human trafficking rings flourished since start Syrian conflict children victims sold across borders Lebanon Yasmani Tomas defects Cuba Fri Jun 2014 collegian team source Granma learned departure country unscrupulous illegal human trafficking player Industriales team Yasmani Tomas article read Baseball America also confirmed Eric Cantor Stepping Majority Leader Wed Jun 2014 Americans Facing summer driving season got full set bills probably got another group human trafficking bills done chairman house financial services committee believe announced markup tree Says Military Takeovers Libya Thailand Coups Tue May 2014 Libya sovereignty strengthening counterterrorism cooperation funds programs Thailand target human trafficking narcotics antiterrorism FY2014 requested million assistance funding Excerpt Richard Clarke Sting Drone Wed May 2014 Mexicans agreed help human trafficking therefore assumed affiliated Hezbollah terrorists back alternative Hezbollah Mexican human trafficking caper two Intelligence Community men nodded Help Effort Bring Back Kidnapped Nigerian Girls Wed May 2014 government attention present kidnapping get involved End Trafficking project help put stop human trafficking Zama Coursen Neff director Childrenâ Rights Division Human Rights Watch suggestions individuals Nigerian Government Vows Find Kidnapped Girls Mon May 2014 media bringbackour girls going viral Twitter girls aged likely part massive human trafficking operation sold marriage mere dollars Despite promises Nigeria president intensify search Maryland Police Dept Live Tweet Prostitution Sting Fri May 2014 point misdemeaners done PGPD sex workers gonna drag hashtag PGPDVice girls women involved prostitution victims human trafficking Vice Unit regularly helps trafficked women connect Obama Asia Challenge Wed Apr 2014 WASHINGTON heir billion dollar hotel fortune Patrick Gage avowed warrior global fight human trafficking ABC GREGORY KRIEG notes ask beer talk would letter law Young Money Talks Old School Game Washington Tue Apr 2014 Images heir billion dollar hotel fortune Patrick Gage avowed warrior global fight human trafficking ask beer talk would letter law compelled turn invitation Week Faith Politics Sun Apr 2014 say say support gay marriage move gay marriage move human rights human trafficking many issues think animate people want church like gospel preach Excerpt Ralph Reed Awakening Thu Apr 2014 encourages sexual exploitation children Human trafficking generates estimated billion year ages thirteen fourteen years Cybersex slavery thrives Internet surpassed brothels Yasiel Puig subjected threats suit Wed Apr 2014 investigation uncovers new details Puig harrowing escape Cuba complexities illegal human trafficking rings continue shuttle major league prospects island magazine report posted online Thursday New details Yasiel Puig defection Wed Apr 2014 investigation uncovers new details Puig harrowing escape Cuba complexities illegal human trafficking rings continue shuttle major league prospects island magazine report posted online Thursday Woman Escapes Weeks Long Cross Country Abduction Cops Say Tue Apr 2014 Jail investigation aggravated human trafficking kidnapping Salt Lake County charged four felony counts human trafficking kidnapping abduction aggravated charged two felony counts human trafficking hold Marshals World Powers Kick Russia Tue Mar 2014 world prevent terrorism nuclear proliferation human trafficking whole host issues think would concern around Terrorism counter proliferation Human trafficking something think would say Malaysian Flight Mystery Reveals Loophole Passport Checks Sun Mar 2014 plane fraudulent passports commonly used illicit criminal stuff like smuggling drug trafficking human trafficking people buy work verification purposes Still another former senior law enforcement"
"http://articles.chicagotribune.com/keyword/human-trafficking";"Feds strip clubs fighting human trafficking Annie Sweeney Tribune reporter April 2014 standard hotel conference room scene slices fresh fruit muffins laid next coffee urns bottles water chilling ice attendees straggled industry friends hugging hello quickly catching personal lives west suburban conference though hardly typical got started hotel manager standing near cameras cover event even asked organizer leave hotel chain name remarks possible NEWS Former Korean comfort women troops sue government min Park Reuters July 2014 Cho Myung ran away home teenager escape father beat finding way red light district South Korean town hosts large Army garrison escaped home early 1960s pimp sold one brothels allowed government serve American soldiers hard life got sick Cho said interview cluttered room shack outside Camp Humphreys busy document close frameborder scrolling width 300 height 250 Advertisement Human trafficking Super Bowl Sister Pat Bergen February 2012 crowd starting swell Indianapolis Super Bowl XLVI many looking amusement game time commercial sex industry ready oblige sure imported generous supply victim prostitutes pleasure countless game goers town Local federal officials acknowledge organized prostitution accompanies major sports events like Olympics World Cup Super Bowl big money Adding even NEWS kids come border Steve Chapman July 2014 foreigner crossed Rio Grande near Hidalgo Texas day spent three weeks traveling Honduras carrying one thing birth certificate hoping find relatives San Antonio Maryland name Alejandro years old story photo appeared New York Times providing stark reminder unauthorized immigration often involves harmless individuals guilty nothing angry reaction surge document close frameborder scrolling width 300 height 110 NEWS years sex ring boss convicted human trafficking Staff report July 2011 Chicago man convicted running operation forced women prostitution sentenced years prison today according Cook County state attorney office Troy Bonaparte 8000 block South Ridgeland Avenue convicted March involuntary servitude trafficking persons forced labor pandering first person convicted Cook County updated laws human trafficking Cook County NEWS says Thailand Malaysia Venezuela among worst human trafficking centers David Brunnstrom Reuters June 2014 United States downgraded Thailand Malaysia Venezuela list world worst centers human trafficking Friday opening countries possible sanctions dumping category North Korea Syria three countries downgraded lowest Tier status State Department 2014 Trafficking Persons Report fully comply minimum standards NEWS lawmakers press Obama administration human trafficking Reuters April 2014 WASHINGTON Reuters lawmakers called Obama administration Tuesday punish countries little fight human trafficking including Thailand Malaysia said Myanmar receive waiver avoid possible sanctions record Citing reports exploitation Myanmar Rohingya Muslim minority home country well Thailand Malaysia Republican Representative Chris Smith said authorities NEWS Cycling trip part adventure part philanthropy Donald Liebenson Special Tribune June 2014 Four freshly minted Trinity International University graduates combining desire end college adventure serious mission raising money awareness scourge human trafficking bicycle Deerfield Mission Viejo Calif Barrington resident Dan Johnson Jono Mullins Dustin Alewine Mission Viejo Tommy Kenney Colorado Springs partnered Bright Hope profit organization based NEWS Special Report Flaws found Thailand human trafficking crackdown Andrew Marshall Amy Sawitta Lefevre Reuters April 2014 SATUN Thailand Reuters two hour trek swamp jungle Police Major General Thatchai Pitaneelaboot halts trash strewn clearing near Thailand remote border Malaysia says surveying remains deserted camp hillside pressed flat weight human bodies weeks says Thatchai hundreds Rohingya Muslim refugees Myanmar held captive one shadowy gangs NEWS New campaign sex trafficking children David Jackson Tribune reporter May 2014 State child welfare officials today launched public awareness campaign combat trafficking youth prostitution pornography schemes None look way said Bobbie Gregg acting director Illinois Department Children Family Services news conference Thompson Center Chicago Flanked county federal law enforcement officials Gregg appealed public alert law enforcement believe child NEWS Fifth graders join fight human trafficking Paige Fumo Fox Special Tribune May 2013 Fifth graders Tye Johnson class Beye Elementary School Oak Park learned lot means denied freedom colonists dawn American Revolution treatment Native Americans civil rights movement talked injustice throughout school year also tried fight injustice today world namely human trafficking organized two fundraisers benefit Chicago based SPORTS Nuns backed pope warn human trafficking World Cup Philip Pullella Reuters May 2014 Philip Pullella VATICAN CITY Reuters Roman Catholic nuns backed Pope Francis Tuesday raised alarm increased risks human trafficking exploitation workers forced prostitution sexual tourism football World Cup Brazil next month nuns whose campaign also backed embassy Vatican announced international campaign called Play Favour Life Denounce Human Trafficking risks say NEWS Declaring WAR human trafficking Amanda Marrazzo Special Tribune September 2010 Rebecca McDonald resolve help exploited women girls around world began emerge teenager put together relief packages destitute families Bangladeshi hospital father worked 1970s McDonald learned Nehru local girl befriended raped men family spoke men poured acid throat teach voice McDonald said girl never spoke acid NEWS Groups say Thailand face sanctions trafficking Reuters May 2014 WASHINGTON Reuters Thailand liable potential sanctions failing crack trafficking migrant workers group human rights labor organizations said Friday letter Secretary State John Kerry organizations including Human Rights Watch American Federation Labor said Thailand meet minimum standards Trafficking Victims Protection Act taking real steps meet NEWS Focus human trafficking shifts labor Annie Sweeney Chicago Tribune reporter December 2013 determined apparently worried boss pressed employee details injuries roommate suffered Cook County probably would recently charged first labor trafficking case Though case turns typical labor trafficking prosecution head worker exposing crime social service providers experts say reflects broader though perhaps less understood policed type human trafficking people exploited NEWS lawmakers press Obama administration human trafficking Reuters April 2014 WASHINGTON Reuters lawmakers called Obama administration Tuesday punish countries little fight human trafficking including Thailand Malaysia said Myanmar receive waiver avoid possible sanctions record Citing reports exploitation Myanmar Rohingya Muslim minority home country well Thailand Malaysia Republican Representative Chris Smith said authorities document close frameborder scrolling width 300 height 110 NEWS New state human trafficking law would permit wiretaps Antonio Olivo Tribune reporter June 2010 Chicago area hotels truck stops even suburban homes children sold prostitution forced labor Cook County State Attorney Anita Alvarez said Wednesday state law human trafficking enacted 2005 previously strictly federal issue little impact part often difficult get victims cooperate Alvarez said Next week new state law expected enacted would allow NEWS Special Report Flaws found Thailand human trafficking crackdown Andrew Marshall Amy Sawitta Lefevre Reuters April 2014 SATUN Thailand Reuters two hour trek swamp jungle Police Major General Thatchai Pitaneelaboot halts trash strewn clearing near Thailand remote border Malaysia says surveying remains deserted camp hillside pressed flat weight human bodies weeks says Thatchai hundreds Rohingya Muslim refugees Myanmar held captive one shadowy gangs NEWS says Thailand Malaysia Venezuela among worst human trafficking centers David Brunnstrom Reuters June 2014 United States downgraded Thailand Malaysia Venezuela list world worst centers human trafficking Friday opening countries possible sanctions dumping category North Korea Syria three countries downgraded lowest Tier status State Department 2014 Trafficking Persons Report fully comply minimum standards NEWS Feds strip clubs fighting human trafficking Annie Sweeney Tribune reporter April 2014 standard hotel conference room scene slices fresh fruit muffins laid next coffee urns bottles water chilling ice attendees straggled industry friends hugging hello quickly catching personal lives west suburban conference though hardly typical got started hotel manager standing near cameras cover event even asked organizer leave hotel chain name remarks possible"
"http://dailysignal.com/...haugens-congressional-testimony-human-trafficking";"permission access haugens congressional testimony human trafficking server Apache Red Hat Server dailysignal com Port"
